{
  "proto": "arena/1",
  "type": "WELCOME",
  "seq": 1,
  "payload": {
    "battleId": "btl_practice",
    "selfId": "veh_1",
    "team": "solo",
    "timing": {
      "tickHz": 30,
      "decisionEveryNTicks": 3,
      "decisionDeadlineMs": 80,
      "maxConsecutiveTimeouts": 20
    },
    "rules": {
      "mode": "deathmatch",
      "rulesetId": "dm_practice@1"
    },
    "vehicle": {
      "chassis": {
        "moduleId": "chassis.light@1",
        "hullHp": 180,
        "radiusM": 1.2
      },
      "modules": [],
      "massKg": 900,
      "energy": {
        "capacityEU": 200,
        "generationEUs": 10
      }
    },
    "map": {
      "mapId": "practice-empty",
      "mapVersion": 1,
      "checksum": "sha256:0000000000000000000000000000000000000000000000000000000000000000",
      "widthM": 60,
      "heightM": 40
    },
    "versions": {
      "engine": "0.4.0",
      "rules": "dm_practice@1",
      "catalog": "mvp@1",
      "protocol": "arena/1"
    }
  }
}
