{
  "proto": "arena/1",
  "type": "WELCOME",
  "seq": 1,
  "payload": {
    "battleId": "btl_2026_07_13_0001",
    "selfId": "veh_3",
    "team": "red",
    "timing": {
      "tickHz": 30,
      "decisionEveryNTicks": 3,
      "decisionDeadlineMs": 80,
      "maxConsecutiveTimeouts": 20
    },
    "rules": {
      "mode": "capture_the_flag",
      "rulesetId": "ctf_mvp@1",
      "timeLimitTicks": 9000,
      "scoreToWin": 3,
      "friendlyFire": false,
      "respawn": {
        "enabled": true,
        "delayTicks": 150
      },
      "sharedTeamVision": false,
      "radio": {
        "maxMessageBytes": 32,
        "maxMessagesPerSecond": 2,
        "deliveryDelayDecisions": 1
      }
    },
    "vehicle": {
      "chassis": {
        "moduleId": "chassis.medium@1",
        "hullHp": 300,
        "radiusM": 1.6
      },
      "modules": [
        {
          "slot": "drive",
          "moduleId": "movement.tracks@1",
          "category": "movement",
          "specs": {
            "maxSpeedMs": 9,
            "turnRateRads": 1.2
          }
        },
        {
          "slot": "power",
          "moduleId": "power.battery@1",
          "category": "power",
          "specs": {
            "capacityEU": 400
          }
        },
        {
          "slot": "sensor_a",
          "moduleId": "sensor.lidar360@1",
          "category": "sensor",
          "specs": {
            "rangeM": 40,
            "rays": 64
          }
        },
        {
          "slot": "turret_main",
          "moduleId": "weapon.cannon@1",
          "category": "weapon",
          "specs": {
            "damage": 45,
            "cooldownTicks": 30
          }
        },
        {
          "slot": "armor_front",
          "moduleId": "armor.steel@1",
          "category": "armor",
          "specs": {
            "sector": "front",
            "reduction": 0.35
          }
        }
      ],
      "massKg": 2400,
      "energy": {
        "capacityEU": 400,
        "generationEUs": 18
      }
    },
    "map": {
      "mapId": "mvp-arena-01",
      "mapVersion": 1,
      "checksum": "sha256:3b1c9f0a7d2e4658a19b0c3d5e6f7a8b9c0d1e2f3a4b5c6d7e8f9a0b1c2d3e4f",
      "widthM": 120,
      "heightM": 80,
      "spawns": [
        {
          "team": "red",
          "position": {
            "x": 10,
            "y": 40
          }
        },
        {
          "team": "blue",
          "position": {
            "x": 110,
            "y": 40
          }
        }
      ],
      "bases": [
        {
          "team": "red",
          "position": {
            "x": 8,
            "y": 40
          }
        },
        {
          "team": "blue",
          "position": {
            "x": 112,
            "y": 40
          }
        }
      ]
    },
    "teammates": [
      "veh_4"
    ],
    "versions": {
      "engine": "0.4.0",
      "physics": "rapier2d-compat@0.14.0+sha256:ab12",
      "rules": "ctf_mvp@1",
      "catalog": "mvp@1",
      "protocol": "arena/1"
    }
  }
}
