{
  "proto": "arena/1",
  "type": "WELCOME",
  "seq": 1,
  "payload": {
    "battleId": "btl_skirmish_low_budget",
    "selfId": "veh_1",
    "team": "red",
    "timing": {
      "tickHz": 30,
      "decisionEveryNTicks": 3,
      "decisionDeadlineMs": 80,
      "maxConsecutiveTimeouts": 20
    },
    "rules": {
      "mode": "deathmatch",
      "rulesetId": "skirmish_low@1",
      "budgetCredits": 600,
      "timeLimitTicks": 4500
    },
    "vehicle": {
      "chassis": {
        "moduleId": "chassis.light@1",
        "hullHp": 180,
        "radiusM": 1.2
      },
      "modules": [
        {
          "slot": "drive",
          "moduleId": "movement.wheels@1",
          "category": "movement"
        }
      ],
      "massKg": 900,
      "energy": {
        "capacityEU": 200,
        "generationEUs": 10
      }
    },
    "map": {
      "mapId": "mvp-arena-01",
      "mapVersion": 1,
      "checksum": "sha256:3b1c9f0a7d2e4658a19b0c3d5e6f7a8b9c0d1e2f3a4b5c6d7e8f9a0b1c2d3e4f",
      "widthM": 120,
      "heightM": 80
    },
    "versions": {
      "engine": "0.4.0",
      "rules": "skirmish_low@1",
      "catalog": "mvp@1",
      "protocol": "arena/1"
    }
  }
}
